{
  "schemaVersion": "1.0.0",
  "generatedAt": "2026-05-08T16:47:35.128266Z",
  "sourceMode": "workflow",
  "anchorPolicy": {
    "usesUserVisibleFilteredTopStories": false,
    "usesReadSuppression": false,
    "usesViewCountSuppression": false,
    "usesCustomSortTopStories": false
  },
  "anchors": [
    {
      "id": "anchor-94157642-6275-4970-a3c5-eecf477d6704",
      "title": "Story 1 from national/general",
      "summary": "",
      "source": "national/general",
      "sourceGroup": "unknown_group",
      "url": "",
      "publishedAt": 1778255254782,
      "impactScore": 0.8,
      "section": "general",
      "tier": "C",
      "entities": [],
      "keywords": [],
      "eventVerbs": [],
      "canonicalText": "Story 1 from national/general"
    }
  ]
}